[
  {
    "taskId": "t_001",
    "noteId": "mn_001",
    "content": "계약서 초안 송부",
    "dueDate": "2026-10-16",
    "dueDateIsDefault": false,
    "assignee": "user_001",
    "counterpartPersonId": "p_001",
    "commitmentKind": "EXPLICIT",
    "taskType": "CONTRACT_PREP",
    "taskTypeConfidence": 1.0,
    "taskTypeSource": "HUMAN",
    "evidence": "계약서 초안은 이번 주 금요일까지 보내드리기로 함",
    "prerequisites": ["계약 유형 판정", "필요 서류 목록 확인"],
    "status": "CONFIRMED"
  },
  {
    "taskId": "t_002",
    "noteId": "mn_001",
    "content": "투입 일정 검토 회신 여부 확인",
    "dueDate": "2026-10-21",
    "dueDateIsDefault": true,
    "assignee": "user_001",
    "counterpartPersonId": "p_001",
    "commitmentKind": "IMPLICIT",
    "taskType": "NONE",
    "taskTypeConfidence": 0.55,
    "taskTypeSource": "MODEL",
    "evidence": "투입 시기는 내부 검토해 보고 다시 말씀 주신다고 함",
    "status": "DRAFT"
  },
  {
    "taskId": "t_003",
    "noteId": "mn_001",
    "content": "11월 첫 주 재방문 미팅 준비",
    "dueDate": "2026-11-02",
    "dueDateIsDefault": true,
    "assignee": "user_001",
    "counterpartPersonId": "p_001",
    "commitmentKind": "EXPLICIT",
    "taskType": "MEETING_PREP",
    "taskTypeConfidence": 0.81,
    "taskTypeSource": "MODEL",
    "evidence": "11월 첫 주에 다시 뵙기로",
    "status": "CONFIRMED"
  }
]
